{
  "$schema": "./stickers.schema.json",
  "version": "1.0.0",
  "description": "贴花/花字模板清单。内部模板需确保商用授权；Fluent Emoji 精选为 MIT 许可。",
  "categories": [
    {
      "id": "hook",
      "name": "钩子/引流",
      "tags": [
        "hook",
        "attention",
        "爆款"
      ]
    },
    {
      "id": "conflict",
      "name": "冲突",
      "tags": [
        "conflict",
        "drama",
        "打脸"
      ]
    },
    {
      "id": "twist",
      "name": "反转",
      "tags": [
        "twist",
        "震惊",
        "反转"
      ]
    },
    {
      "id": "cliff",
      "name": "悬念",
      "tags": [
        "cliff",
        "悬念",
        "下集"
      ]
    },
    {
      "id": "cta",
      "name": "转化引导",
      "tags": [
        "cta",
        "追剧",
        "点这里"
      ]
    },
    {
      "id": "romance",
      "name": "甜宠",
      "tags": [
        "romance",
        "甜宠",
        "恋爱"
      ]
    },
    {
      "id": "ancient",
      "name": "古装",
      "tags": [
        "ancient",
        "古装",
        "宫斗"
      ]
    },
    {
      "id": "revenge",
      "name": "逆袭",
      "tags": [
        "revenge",
        "逆袭",
        "重生"
      ]
    }
  ],
  "templates": [
    {
      "id": "hook-red-boom",
      "name": "爆款红色爆炸贴",
      "type": "image",
      "file": "hook-red-boom.png",
      "categories": [
        "hook"
      ],
      "tags": [
        "hook",
        "attention",
        "爆款"
      ],
      "defaultPosition": "center",
      "defaultScale": 0.6,
      "durationSec": 1.5,
      "loop": true,
      "textPlaceholder": null,
      "license": "internal",
      "licenseScope": "internal"
    },
    {
      "id": "conflict-vs",
      "name": "冲突对决框",
      "type": "image",
      "file": "conflict-vs.png",
      "categories": [
        "conflict"
      ],
      "tags": [
        "conflict",
        "drama",
        "打脸"
      ],
      "defaultPosition": "center",
      "defaultScale": 0.55,
      "durationSec": 2,
      "loop": true,
      "textPlaceholder": null,
      "license": "internal",
      "licenseScope": "internal"
    },
    {
      "id": "twist-shock",
      "name": "反转震惊贴",
      "type": "image",
      "file": "twist-shock.png",
      "categories": [
        "twist"
      ],
      "tags": [
        "twist",
        "震惊",
        "反转"
      ],
      "defaultPosition": "top",
      "defaultScale": 0.5,
      "durationSec": 1.5,
      "loop": true,
      "textPlaceholder": null,
      "license": "internal",
      "licenseScope": "internal"
    },
    {
      "id": "cliff-next",
      "name": "悬念下集引导",
      "type": "image",
      "file": "cliff-next.png",
      "categories": [
        "cliff"
      ],
      "tags": [
        "cliff",
        "悬念",
        "下集"
      ],
      "defaultPosition": "bottom",
      "defaultScale": 0.45,
      "durationSec": 2,
      "loop": true,
      "textPlaceholder": null,
      "license": "internal",
      "licenseScope": "internal"
    },
    {
      "id": "cta-follow",
      "name": "追剧引导贴",
      "type": "image",
      "file": "cta-follow.png",
      "categories": [
        "cta"
      ],
      "tags": [
        "cta",
        "追剧",
        "点这里"
      ],
      "defaultPosition": "bottom-right",
      "defaultScale": 0.4,
      "durationSec": 3,
      "loop": true,
      "textPlaceholder": null,
      "license": "internal",
      "licenseScope": "internal"
    },
    {
      "id": "title-romance-ribbon",
      "name": "甜宠标题丝带",
      "type": "image",
      "file": "title-romance-ribbon.png",
      "categories": [
        "romance",
        "hook"
      ],
      "tags": [
        "romance",
        "甜宠",
        "恋爱",
        "title"
      ],
      "defaultPosition": "top",
      "defaultScale": 0.7,
      "durationSec": 3,
      "loop": true,
      "textPlaceholder": "${dramaTitle}",
      "license": "internal",
      "licenseScope": "internal"
    },
    {
      "id": "title-ancient-gold",
      "name": "古装金字标题",
      "type": "image",
      "file": "title-ancient-gold.png",
      "categories": [
        "ancient",
        "hook"
      ],
      "tags": [
        "ancient",
        "古装",
        "宫斗",
        "title"
      ],
      "defaultPosition": "top",
      "defaultScale": 0.7,
      "durationSec": 3,
      "loop": true,
      "textPlaceholder": "${dramaTitle}",
      "license": "internal",
      "licenseScope": "internal"
    },
    {
      "id": "fluent-fire",
      "name": "火焰",
      "type": "image",
      "file": "fluent-emoji/fluent-fire.png",
      "categories": [
        "hook"
      ],
      "tags": [
        "hook",
        "attention",
        "爆款",
        "hot"
      ],
      "defaultPosition": "center",
      "defaultScale": 0.5,
      "durationSec": 1.5,
      "loop": true,
      "textPlaceholder": null,
      "license": "MIT",
      "licenseScope": "all-platform",
      "attribution": "Microsoft Fluent Emoji"
    },
    {
      "id": "fluent-star",
      "name": "星星",
      "type": "image",
      "file": "fluent-emoji/fluent-star.png",
      "categories": [
        "hook"
      ],
      "tags": [
        "hook",
        "attention",
        "star"
      ],
      "defaultPosition": "top-right",
      "defaultScale": 0.45,
      "durationSec": 2,
      "loop": true,
      "textPlaceholder": null,
      "license": "MIT",
      "licenseScope": "all-platform",
      "attribution": "Microsoft Fluent Emoji"
    },
    {
      "id": "fluent-glowing-star",
      "name": "闪耀之星",
      "type": "image",
      "file": "fluent-emoji/fluent-glowing-star.png",
      "categories": [
        "hook"
      ],
      "tags": [
        "hook",
        "attention",
        "sparkle"
      ],
      "defaultPosition": "top",
      "defaultScale": 0.5,
      "durationSec": 2,
      "loop": true,
      "textPlaceholder": null,
      "license": "MIT",
      "licenseScope": "all-platform",
      "attribution": "Microsoft Fluent Emoji"
    },
    {
      "id": "fluent-sparkles",
      "name": "闪光",
      "type": "image",
      "file": "fluent-emoji/fluent-sparkles.png",
      "categories": [
        "hook"
      ],
      "tags": [
        "hook",
        "sparkle",
        "shine"
      ],
      "defaultPosition": "center",
      "defaultScale": 0.45,
      "durationSec": 1.5,
      "loop": true,
      "textPlaceholder": null,
      "license": "MIT",
      "licenseScope": "all-platform",
      "attribution": "Microsoft Fluent Emoji"
    },
    {
      "id": "fluent-money-bag",
      "name": "钱袋",
      "type": "image",
      "file": "fluent-emoji/fluent-money-bag.png",
      "categories": [
        "hook",
        "climax"
      ],
      "tags": [
        "hook",
        "money",
        "wealth"
      ],
      "defaultPosition": "top-right",
      "defaultScale": 0.45,
      "durationSec": 2,
      "loop": true,
      "textPlaceholder": null,
      "license": "MIT",
      "licenseScope": "all-platform",
      "attribution": "Microsoft Fluent Emoji"
    },
    {
      "id": "fluent-money-with-wings",
      "name": "长翅膀的钱",
      "type": "image",
      "file": "fluent-emoji/fluent-money-with-wings.png",
      "categories": [
        "hook"
      ],
      "tags": [
        "hook",
        "money",
        "rich"
      ],
      "defaultPosition": "top-right",
      "defaultScale": 0.45,
      "durationSec": 2,
      "loop": true,
      "textPlaceholder": null,
      "license": "MIT",
      "licenseScope": "all-platform",
      "attribution": "Microsoft Fluent Emoji"
    },
    {
      "id": "fluent-party-popper",
      "name": "庆祝彩带",
      "type": "image",
      "file": "fluent-emoji/fluent-party-popper.png",
      "categories": [
        "hook",
        "climax"
      ],
      "tags": [
        "hook",
        "celebrate",
        "party"
      ],
      "defaultPosition": "top",
      "defaultScale": 0.5,
      "durationSec": 1.5,
      "loop": true,
      "textPlaceholder": null,
      "license": "MIT",
      "licenseScope": "all-platform",
      "attribution": "Microsoft Fluent Emoji"
    },
    {
      "id": "fluent-wrapped-gift",
      "name": "礼物",
      "type": "image",
      "file": "fluent-emoji/fluent-wrapped-gift.png",
      "categories": [
        "hook",
        "cta"
      ],
      "tags": [
        "hook",
        "gift",
        "free"
      ],
      "defaultPosition": "bottom-right",
      "defaultScale": 0.45,
      "durationSec": 2,
      "loop": true,
      "textPlaceholder": null,
      "license": "MIT",
      "licenseScope": "all-platform",
      "attribution": "Microsoft Fluent Emoji"
    },
    {
      "id": "fluent-rocket",
      "name": "火箭",
      "type": "image",
      "file": "fluent-emoji/fluent-rocket.png",
      "categories": [
        "hook"
      ],
      "tags": [
        "hook",
        "boost",
        "hot"
      ],
      "defaultPosition": "center-right",
      "defaultScale": 0.5,
      "durationSec": 2,
      "loop": true,
      "textPlaceholder": null,
      "license": "MIT",
      "licenseScope": "all-platform",
      "attribution": "Microsoft Fluent Emoji"
    },
    {
      "id": "fluent-hundred-points",
      "name": "满分",
      "type": "image",
      "file": "fluent-emoji/fluent-hundred-points.png",
      "categories": [
        "hook"
      ],
      "tags": [
        "hook",
        "top",
        "must-see"
      ],
      "defaultPosition": "top-left",
      "defaultScale": 0.45,
      "durationSec": 2,
      "loop": true,
      "textPlaceholder": null,
      "license": "MIT",
      "licenseScope": "all-platform",
      "attribution": "Microsoft Fluent Emoji"
    },
    {
      "id": "fluent-warning",
      "name": "警告",
      "type": "image",
      "file": "fluent-emoji/fluent-warning.png",
      "categories": [
        "hook"
      ],
      "tags": [
        "hook",
        "warning",
        "alert"
      ],
      "defaultPosition": "center",
      "defaultScale": 0.5,
      "durationSec": 1.5,
      "loop": true,
      "textPlaceholder": null,
      "license": "MIT",
      "licenseScope": "all-platform",